<?xml version="1.0" encoding="UTF-8"?>
<!DOCTYPE gallery SYSTEM "gallery.dtd">
<?xml-stylesheet type="text/xsl" href="gallery.xml"?>

<gallery>

<galleryName><![CDATA[Image Gallery]]></galleryName>
<folderName><![CDATA[../Wallpapper_4]]></folderName>
<imagesFullsize><![CDATA[]]></imagesFullsize>

<images>

<image>
<filename>3001_7WHmX69.jpg</filename>
<title></title>
<description></description>
<date></date>
<location></location>
<physical>
<width>960</width>
<height>600</height>
</physical>
</image>

<image>
<filename>3002_3KSh2wl.jpg</filename>
<title></title>
<description></description>
<date></date>
<location></location>
<physical>
<width>960</width>
<height>600</height>
</physical>
</image>

<image>
<filename>3003_ITjIr3I.jpg</filename>
<title></title>
<description></description>
<date></date>
<location></location>
<physical>
<width>960</width>
<height>600</height>
</physical>
</image>

<image>
<filename>3004_uHegYJX.jpg</filename>
<title></title>
<description></description>
<date></date>
<location></location>
<physical>
<width>960</width>
<height>600</height>
</physical>
</image>

<image>
<filename>3005_SnY4w0z.jpg</filename>
<title></title>
<description></description>
<date></date>
<location></location>
<physical>
<width>960</width>
<height>600</height>
</physical>
</image>

<image>
<filename>3006_0BcOK5r.jpg</filename>
<title></title>
<description></description>
<date></date>
<location></location>
<physical>
<width>960</width>
<height>600</height>
</physical>
</image>

<image>
<filename>3007_YMyaQtm.jpg</filename>
<title></title>
<description></description>
<date></date>
<location></location>
<physical>
<width>960</width>
<height>600</height>
</physical>
</image>

<image>
<filename>3008_bdNG7Fu.jpg</filename>
<title></title>
<description></description>
<date></date>
<location></location>
<physical>
<width>960</width>
<height>600</height>
</physical>
</image>

<image>
<filename>3009_zwrgSFF.jpg</filename>
<title></title>
<description></description>
<date></date>
<location></location>
<physical>
<width>960</width>
<height>600</height>
</physical>
</image>

<image>
<filename>3010_shn7nVS.jpg</filename>
<title></title>
<description></description>
<date></date>
<location></location>
<physical>
<width>960</width>
<height>600</height>
</physical>
</image>

<image>
<filename>3011_Y0NcdL5.jpg</filename>
<title></title>
<description></description>
<date></date>
<location></location>
<physical>
<width>960</width>
<height>600</height>
</physical>
</image>

<image>
<filename>3012_cCmsqA5.jpg</filename>
<title></title>
<description></description>
<date></date>
<location></location>
<physical>
<width>960</width>
<height>600</height>
</physical>
</image>

<image>
<filename>3013_tHmxCgq.jpg</filename>
<title></title>
<description></description>
<date></date>
<location></location>
<physical>
<width>960</width>
<height>600</height>
</physical>
</image>

<image>
<filename>3014_YfGXENY.jpg</filename>
<title></title>
<description></description>
<date></date>
<location></location>
<physical>
<width>960</width>
<height>600</height>
</physical>
</image>

<image>
<filename>3015_8HyX9tU.jpg</filename>
<title></title>
<description></description>
<date></date>
<location></location>
<physical>
<width>960</width>
<height>600</height>
</physical>
</image>

<image>
<filename>3016_FfBGa2g.jpg</filename>
<title></title>
<description></description>
<date></date>
<location></location>
<physical>
<width>960</width>
<height>600</height>
</physical>
</image>

<image>
<filename>3017_ypPiipY.jpg</filename>
<title></title>
<description></description>
<date></date>
<location></location>
<physical>
<width>960</width>
<height>600</height>
</physical>
</image>

<image>
<filename>3018_6LBiSKy.jpg</filename>
<title></title>
<description></description>
<date></date>
<location></location>
<physical>
<width>960</width>
<height>600</height>
</physical>
</image>

<image>
<filename>3019_bHS0BnQ.jpg</filename>
<title></title>
<description></description>
<date></date>
<location></location>
<physical>
<width>960</width>
<height>600</height>
</physical>
</image>

<image>
<filename>3020_rwYG2eg.jpg</filename>
<title></title>
<description></description>
<date></date>
<location></location>
<physical>
<width>960</width>
<height>600</height>
</physical>
</image>

<image>
<filename>3021_UsN7XwY.jpg</filename>
<title></title>
<description></description>
<date></date>
<location></location>
<physical>
<width>960</width>
<height>600</height>
</physical>
</image>

<image>
<filename>3022_h7NS1Qu.jpg</filename>
<title></title>
<description></description>
<date></date>
<location></location>
<physical>
<width>960</width>
<height>600</height>
</physical>
</image>

<image>
<filename>3023_7GLBho6.jpg</filename>
<title></title>
<description></description>
<date></date>
<location></location>
<physical>
<width>960</width>
<height>600</height>
</physical>
</image>

<image>
<filename>3024_Fwt0Dw8.jpg</filename>
<title></title>
<description></description>
<date></date>
<location></location>
<physical>
<width>960</width>
<height>600</height>
</physical>
</image>

<image>
<filename>3025_zp3bjlh.jpg</filename>
<title></title>
<description></description>
<date></date>
<location></location>
<physical>
<width>960</width>
<height>600</height>
</physical>
</image>

<image>
<filename>3026_ebz0MWf.jpg</filename>
<title></title>
<description></description>
<date></date>
<location></location>
<physical>
<width>960</width>
<height>600</height>
</physical>
</image>

<image>
<filename>3027_F99tgSw.jpg</filename>
<title></title>
<description></description>
<date></date>
<location></location>
<physical>
<width>960</width>
<height>600</height>
</physical>
</image>

<image>
<filename>3028_Ndvco0g.jpg</filename>
<title></title>
<description></description>
<date></date>
<location></location>
<physical>
<width>960</width>
<height>600</height>
</physical>
</image>

<image>
<filename>3029_Ep9xJXP.jpg</filename>
<title></title>
<description></description>
<date></date>
<location></location>
<physical>
<width>960</width>
<height>600</height>
</physical>
</image>

<image>
<filename>3030_oK8w8KP.jpg</filename>
<title></title>
<description></description>
<date></date>
<location></location>
<physical>
<width>960</width>
<height>600</height>
</physical>
</image>

<image>
<filename>3031_JTGpFju.jpg</filename>
<title></title>
<description></description>
<date></date>
<location></location>
<physical>
<width>960</width>
<height>600</height>
</physical>
</image>

<image>
<filename>3032_yyfTEGC.jpg</filename>
<title></title>
<description></description>
<date></date>
<location></location>
<physical>
<width>960</width>
<height>600</height>
</physical>
</image>

<image>
<filename>3033_suMAXFi.jpg</filename>
<title></title>
<description></description>
<date></date>
<location></location>
<physical>
<width>960</width>
<height>600</height>
</physical>
</image>

<image>
<filename>3034_dGsF0bA.jpg</filename>
<title></title>
<description></description>
<date></date>
<location></location>
<physical>
<width>960</width>
<height>600</height>
</physical>
</image>

<image>
<filename>3035_BpptX7x.jpg</filename>
<title></title>
<description></description>
<date></date>
<location></location>
<physical>
<width>960</width>
<height>600</height>
</physical>
</image>

<image>
<filename>3036_Dspnr1p.jpg</filename>
<title></title>
<description></description>
<date></date>
<location></location>
<physical>
<width>960</width>
<height>600</height>
</physical>
</image>

<image>
<filename>3037_ioKDdPG.jpg</filename>
<title></title>
<description></description>
<date></date>
<location></location>
<physical>
<width>960</width>
<height>600</height>
</physical>
</image>

<image>
<filename>3038_VI9yg40.jpg</filename>
<title></title>
<description></description>
<date></date>
<location></location>
<physical>
<width>960</width>
<height>600</height>
</physical>
</image>

<image>
<filename>3039_nUer71m.jpg</filename>
<title></title>
<description></description>
<date></date>
<location></location>
<physical>
<width>960</width>
<height>600</height>
</physical>
</image>

<image>
<filename>3040_JoPPw8w.jpg</filename>
<title></title>
<description></description>
<date></date>
<location></location>
<physical>
<width>960</width>
<height>600</height>
</physical>
</image>

<image>
<filename>3041_atGJUAu.jpg</filename>
<title></title>
<description></description>
<date></date>
<location></location>
<physical>
<width>960</width>
<height>600</height>
</physical>
</image>

<image>
<filename>3042_T0DIxgb.jpg</filename>
<title></title>
<description></description>
<date></date>
<location></location>
<physical>
<width>960</width>
<height>600</height>
</physical>
</image>

<image>
<filename>3043_Ni84zug.jpg</filename>
<title></title>
<description></description>
<date></date>
<location></location>
<physical>
<width>960</width>
<height>600</height>
</physical>
</image>

<image>
<filename>3044_dp2oTA2.jpg</filename>
<title></title>
<description></description>
<date></date>
<location></location>
<physical>
<width>960</width>
<height>600</height>
</physical>
</image>

<image>
<filename>3045_JO0RT1k.jpg</filename>
<title></title>
<description></description>
<date></date>
<location></location>
<physical>
<width>960</width>
<height>600</height>
</physical>
</image>

<image>
<filename>3046_B6GolsY.jpg</filename>
<title></title>
<description></description>
<date></date>
<location></location>
<physical>
<width>960</width>
<height>600</height>
</physical>
</image>

<image>
<filename>3047_Cbl3taG.jpg</filename>
<title></title>
<description></description>
<date></date>
<location></location>
<physical>
<width>960</width>
<height>600</height>
</physical>
</image>

<image>
<filename>3048_rX6tpQG.jpg</filename>
<title></title>
<description></description>
<date></date>
<location></location>
<physical>
<width>960</width>
<height>600</height>
</physical>
</image>

<image>
<filename>3049_9uVh1VQ.jpg</filename>
<title></title>
<description></description>
<date></date>
<location></location>
<physical>